review,rating,date
"ringan,cepat meresap, waterproof jadi bagus untuk dipake pas mau hangout cuma satu yg kurang",bintang 5,8 bulan lalu
"Isinya lumayan banyak, pengiriman cepat, tahan lama, tipe yang kalo dipakai di bibir kelihatan kering bgt. aku pake buat blush on. packingnya aman",bintang 5,5 bulan lalu
"bagus tekstur nya, cocok buat bibir gelap kyk aku, tapi kalo bisa pilih warna diatas ini aja soalnya terlalu gelap yang ini. pengirimannya cepet juga. packing nya super a...",bintang 5,2 bulan lalu
"Warna nude nya cakep polll, dipake sendiri g bikin aku keliatan pucet apalagi kalo di ombre beuh menyala🔥g bikin kering juga, suka bgt😍",bintang 5,12 bulan lalu
"keren bgt produknya.. fix suka sih sama warnanya bener nude yg kucari2, pigmented dan lgsg set up di bibir, next bakal order lg buat ombrenya karna awal ini cuma mau tes...",bintang 5,6 bulan lalu
"Warna bagus untuk base ombre, pengiriman cepat tapi packing hanya kardus dan bubblewrap, tidak ada secondary kemasan produk, overall oke, good job Emina!",bintang 5,8 bulan lalu
"pengiriman aman, warna bagus, tahan lama, tekstur baik dan sangat cocok untuk sehari hari",bintang 5,3 bulan lalu
"packagingnya aman poll, paragon emang besttt. produk lip nya emina yg ini jg bguss, warnanya cocok buat kulit gelap indo. creamy tp powdery, enak di blend, dan gabikin bi...",bintang 5,4 bulan lalu
"Enak dipakenya, ringan gt. Wanginya jg enak ga ganggu. Warnanya klo diaku kyk seductressnya Maybelline",bintang 5,1 bulan lalu
Beli emina creamatte karena kata orang-orang bagus dan ternyata emang bagus,bintang 5,7 bulan lalu
"koleksi creammate keduaku setelah sebelumnya co shade coral crush. ini warnanya reddish pink gitu menurutku, girly abis. cantik dan pigmented! sekali oles berhasil nutupi...",bintang 5,8 bulan lalu
"creamatte emina bener-bener bagusss banget, ngasih efek blurry waktu dipake, dan ga bikin bibir kering. ini aku mempercantik creamatte ku sm gantungan lucukkk. thank youu...",bintang 5,8 bulan lalu
"bagus warnanyaaa, engga terlalu kering dan nyatu di bibir.udah dari kapan tu mau untung dapet promo wkwkwkwk jadinya dapet harga 4 ribuan deh. next mau nyobain warna lain...",bintang 5,8 bulan lalu
"Sudah sampai, warnanya aku banget. Suka banget sama teksturnya, dan pigmentasinya cukup menutup untuk bibirku yang lumayan gelap. Warnanya nyatu dengan warna kulitku yg k...",bintang 5,8 bulan lalu
"pengiriman lumayan cepet, kurir ramah, aku dapet harga murah karena lagi promo xixixi, tapi salah shade, tapi gak papa sihh bagus jugaakkk",bintang 5,7 bulan lalu
barang yang dikirimkan sesuai pesanan dan harganya murah terima kasih,bintang 5,5 bulan lalu
"warnanya bagus, cantik, ada spf nya, wanginya enak..",bintang 5,3 bulan lalu
"pengiriman cepat, dapet harga 500perak, wrna pink cantik, sukaaa poll",bintang 5,7 bulan lalu
packingnya rapi banget lipstiknya juga gampang banget ngesade,bintang 5,9 bulan lalu
Seneng bnget sama warna ini bagus ringan awet juga abis nya. Cuma seperti nya tekstur nya beda dari yg sebelum nya,bintang 5,6 bulan lalu
"warnanya bagus,tahan lama,teksturnya lembut ringan di bibir",bintang 4,7 bulan lalu
"tekturnya ringan seperti gapakai lipstik, semoga tahan lama  🥰",bintang 5,9 bulan lalu
"formula ringan, tekstur tidak lengket, warna cantik dan cocok untuk semua skintone",bintang 5,8 bulan lalu
"Puas banget, first time nyobain SSnya emina semoga cocok.Dan harus beralih produk Indonesia. makasih gratisannya emina",bintang 5,
cakeeeeeeeppp warnanya..sesuai pesanan..terimakasih..cepet kirim pula..😍😍😍,bintang 5,4 bulan lalu
"sesuai dengan pesanan, belum dicoba packing rapi dan safety banget",bintang 5,
"ini salah satu lip cream kesukaan aku warnanya cocok di wajah aku, produknya cukup tahan lama.. pas dipakai juga nyaman.. buat di jadiin base pas ombre juga bagus
untuk p...",bintang 5,
"seller respon cepat, packaging rapi dan aman, produk bagus, paket sampai dengan cepat. terima kasih yaa",bintang 5,
barang yang dikirimkan sudah sesuai pesanan terima kasih,bintang 5,4 bulan lalu
"karena base ombre ku habis akhirnya mutusin buat beli ini yg shade pumpkin spice. di aku sendiri warnanya tuh brown pink gitu, cocok buat jadi base ombre karena di aku ja...",bintang 5,8 bulan lalu
"Waktu beli, yg ini tdk ada. Mungkin ketinggalan pas packing. Saya cb hub penjual. Alhamdulillah sgt baik. Mau komunikasi dg saya hingga tgh malam. Lalu lipstick dikirim m...",bintang 5,
"EMINA CREAMATTE


✓ Hasil akhir : matte ada sedikit hint glossy nya
✓ Aplikator bentuk kaki
✓ Bisa menutupi garis bibir yang gelap
✓ Tahan lama
✓ Warnanya intens
✓ Transf...",bintang 5,
"EMINA CREAMATTE


✓ Hasil akhir : matte ada sedikit hint glossy nya
✓ Aplikator bentuk kaki
✓ Bisa menutupi garis bibir yang gelap
✓ Tahan lama
✓ Warnanya intens
✓ Transf...",bintang 5,
"bagus sekali, cuma sayang nya transfer tapi memang bikin lembab",bintang 5,8 bulan lalu
"kiri creamatte 07, kanan poppin mate 02. so far kedua warna cocok di saya. pengiriman cepat dan produk sesuai. thank you",bintang 5,
"pengemasan dan pengiriman cepat. pengemasannya safety bgt pake kerdus pdhl cuma 1pcs dapet gift jg. 
untuk warna lipnya dimukaku terlalu pucet yg atas warna asli, yg bawa...",bintang 5,
"ringan banget di bibir, tahan seharian pokonya bagus banget",bintang 5,9 bulan lalu
"brg smp sesuai order dan aman..warnanya bagus, cocok dipakai sehari² dan bibir lbh lembab.",bintang 5,9 bulan lalu
"pengemasan dan pengiriman cepat, belanja dari toko official udh pasti ori dong ya. sangat recommended.",bintang 5,5 bulan lalu
"Terima kasih Emina, belanja di official store dapet bonus creamy tint.
Untuk produk creammatte formulanya tetap enak. Tapi warna fuzzy wuzzy berbeda dari ingatan saya wak...",bintang 5,
"sesuai, teksturnya lembut dan tahan lama.
warnanya juga bagus banget",bintang 5,5 bulan lalu
"warnanya bagus bgt ga nyesel CO shade ini, trus meskipun ini cream matte tapi ga se kering itu si pokonya baguss sukaa luvv thank u eminaa💋🙈",bintang 5,2 bulan lalu
"ini pemakaian ke 2 produk emina creamatte 
teksturnya lembut ,aplikator nyaman dipakai.
warna coklat bagus.",bintang 5,8 bulan lalu
"packing rapi, barang yang dibeli sesuai, pokoknya recommended lah ya.",bintang 5,
"paket aman lengkap tidak ada kerusakan,
-packing menggunakan kardus + Buble warp rapi walaupun hanya 1 barang
-pengiriman cepat karena pakai sicepat jadi cepat
-hanya si...",bintang 4,
"warna yang cocok, dapet bonus juga mini fan",bintang 5,
Udah langganan. Barang sesuai pesanan. Kualitas baik. Pengemasan baik.,bintang 5,
"ini pigmented di bibir two tonedku. pas diswipe cair, lama2 ngeset tapi gak berat. pas ngatup bibir juga gak patchy. di bibir aku too pink tapi masih oke. foto ketiga aku...",bintang 5,8 bulan lalu
"warna nya bagus, ga bikin kering juga di bibir 😍 suka bgt sama tekstur lip creamatte nya 😍👍",bintang 5,9 bulan lalu
baguszjqjsijdmslalamansusiaikamajahwbz avahnana,bintang 5,2 bulan lalu
pelayanan penjual baik tapi pengiriman buruk,bintang 5,
"pengiriman cepat, sangat rapi dan aman packing nya, lip cream nya bagus sukaa cantik bangey😍😘😘😘",bintang 5,
sesuai pesanan dan dapet free nya juga😍,bintang 5,
ringan bgt warnanya menurutku lebih ke coklat bestseller sih pengiriman cepet,bintang 5,4 bulan lalu
"sblmnya udh pny matte lip cream emina, cocok, dibibir enak. cm sayang cepat abis. ini order lagi, coba warna lain. tny ke admin utk natural look. bgitu datang, paling suk...",bintang 5,
"ini beli yg kedua kali, warnanya cakep banget untuk base ombre. cocok banget untuk yg undertone neutral to warm😻",bintang 5,7 bulan lalu
"PROSES
cepat!!!
order tgl 4 jam 1 malem dikemas pagi nya.

PENGIRIMAN
jam satu malem order siang nya udah dikirim

DURASI PENGIRIMAN
24 Jam

PACKAGING
beli cuma satu tapi...",bintang 5,
"chocopuff tuh lebih coklat keunguan, chocolava itu coklat ada hint orange sedikit, bagus 2 warna ini, apalagi utk pecinta lip cream coklat dan gelap",bintang 5,
"packaging nya super duper aman, dapet harga 20k dari voc lupp 🫰🫰❤️❤️",bintang 5,2 bulan lalu
"I LOVE ITTTT, awalnya aku dapet tasternya dari suatu acara wahh ternyara bagus, pas dah abis barulah aku beli yang besar yaaaaaaa",bintang 5,6 bulan lalu
"packing baru lebih rapih dan lebih bagus .
blm dicoba sih.. mudah2 an tekstur dan isinya juga lebih bagus .
krn yg lama terlalu cair dan berminyak 🙏🏼🥺
terimakasih...",bintang 5,12 bulan lalu
"bahannya ringan, warnanya bagus, cepat meresap, tidak membuat bibir kering",bintang 5,6 bulan lalu
Hasilnya tahan lama. Cocok buat kulit gelap. Desainnya mewah. Nggak lengket. Packaging aman 🙏. Nggak bikin bibir kering. Aplikator mudah dipakai.,bintang 5,
Hasilnya tahan lama. Cocok buat kulit gelap. Aplikator mudah dipakai. Nggak cepat pudar. Nggak bikin bibir kering. Nggak lengket.,bintang 5,
Produk tiba dengan selamat tanpa cacat. Pengemasan sangat baik dengan bubble wrap dan dus. Bahan lip creamnya ringan dan cepat kering di bibir. Warnanya sesuai pesanan ka...,bintang 5,
"Warna rekomendasi yang diberikan admin sangat tidak sesuai. Tolong lah untuk admin product knowledge ditingkatkan lagi, jangan asal ngasih rekomendasi. Perky plum sama fu...",bintang 1,6 bulan lalu
"bahannya ringan banget dan cepet ngesetnya, cuma warnanya ternyata pas di apply lebih ke tone orange kalau di kulit aku tapi okee banget",bintang 5,5 bulan lalu
creamy dan tebal tapi tetap lembab dan ringan di bibir. bisa dipake untuk ombre-an.,bintang 5,
"pengemasannya aman bangett, creamatte nya ringann pol gk berasa pake lip cream bungkusnya lushyuuuu sekali😻",bintang 5,9 bulan lalu
belum coba dibibir mudah2an gak bikin lengket dan tetep melembabkan. ini yah swatch nya dibandingkan produk yg lain,bintang 5,
"bahannya ringan , cocok d aku, bagus bagus warnanya",bintang 5,8 bulan lalu
"ukuran lip cream yg pas buat di bawa2, ga mubazir takut expired karna ga terlalu besar, warna cocok bgt dikulit light, harga ekonomis, dibibir lembab... repurchase👍",bintang 5,
"lipcream favorit dari jaman Kuliah. termasuk awet, karena, pakai sedikit saja....sudah cukup keluar warnanya, dipakai seharian pun awet. 
warna2 nya pas buat kulit",bintang 5,"lipcream favorit dari jaman Kuliah. termasuk awet, karena, pakai sedikit saja....sudah cukup keluar warnanya, dipakai seharian pun awet. 
warna2 nya pas buat kulit"
"Bahannya ringan dan bisa cover bibir gelap, pengemasan dan pengirimannya juga aman, Terimakasih ^^",bintang 5,
"Tengkyu tokped & emina, dari creamate yg packagingnya lama sampai kebeli sekarang yg baru karena promo hampir gratis keren bgt. Shadenya memang kusuka ❤️",bintang 5,9 bulan lalu
"paket dikemas aman & rapi, pakai dus + bubble wrap tebal
lip cream lengkap, variasi sesuai pesanan, kondisi segel, expired date 2027
terima kasih 🙏🏻",bintang 5,
"warna bagus cocok dikulitku, tekstur ringan, cocok ga bikin bibir kering",bintang 5,5 bulan lalu
"suka banget sama creamatte ini, teksturnya lembut dan awet. Ngga terlalu berat tapi tetep dapet matte finishnya. Paling suka warna 08 karena netral ke bibir buat sehari h...",bintang 5,
"produk ori, pengiriman cepat , packing mantap",bintang 5,11 bulan lalu
"bahan ringan, gampang diserap, warna cakep",bintang 5,5 bulan lalu
"packagingnya gemes bangett woii, warnanya jg cakep banget sukak, terus jg lumayan tahan lama krn dipake seharian masih ngestain",bintang 5,8 bulan lalu
"bahannya ringan, warnanya literally baguss baguss banget, best creamatte ever ini mah ya",bintang 5,11 bulan lalu
"kok baru Nemu lipcream SE ringan dan se tahan lama ini sihh,ini pake makan juga masih oke stainnya love bangett Emina, ga bikin bibir kering pula, next beli lagii nihh😍�...",bintang 5,11 bulan lalu
Aplikator mudah dipakai Hasilnya matte Nggak bikin bibir kering,bintang 5,
"Barangnya udah nyampe. lagi gapunya uang tapi lipstik habis, alhamdulillah dapet diskon harganya jadi recehan. botolnya kokoh, warnanya sesuai ekspektasi, coklat dengan s...",bintang 5,9 bulan lalu
"Suka banget sama teksturnya, udah repurchase ketiga kalinya dan warnanya cocok di tone medium skin",bintang 5,
"Lip cream enak banget dipakek, ga kering, nutup garis bibir",bintang 5,9 bulan lalu
"exp date semua aman tidak ada yg mepet. seller juga fast response. dan dapat hadiah 2 pcs. terimakasih seller, sukses selalu",bintang 5,
ini bagus betul product nyaa. aku udah beli dua kali karena beneran sesuka itu sama formula nya. dia beneran pigmanted banget dan yang terpenting ga bikin bibir kering. a...,bintang 5,6 bulan lalu
"mantap min, warnanya sangat cantik trs juga cocok di kulit aku, ga bikin berat dibibir juga",bintang 5,9 bulan lalu
"bahan ringan,.warna jg cocok utk aku..skrg muncul dg kemasan baru tp ada beberapa warna yg berbeda..  sya pilih ada warna favorit saya wkt kemasan lama",bintang 5,2 bulan lalu
"bisa buat base ombre, packagingnya cute n simple, agak heran krn gaada box lipnya jd bubble wrap trs langsung barangnya, klo emg gitu yaa its okay 🥰🫶🏻",bintang 5,4 bulan lalu
"Bahannya ringan, mudah ngeblend di bibir dan tahan lama. Udah langganan pake ini dan selalu order di toko resminya",bintang 4,
"akhirnya nyampe jg paketnya. packing rapih, kardus dan lapis bubble. yg botol2 di selotip lagi tutupnya. ga ada yg tumpah atau rusak. warna nya baguuuus..next mo order wa...",bintang 5,
"cakep bgt warna pumpkin spice dan cukup awet. baunya manis kayak kue. expired pun masih lama, tahun 2027.",bintang 5,9 bulan lalu
"barang sesuai pesanan, respon penjualnya cepat, terima kasih🙌",bintang 5,8 bulan lalu
"paling cocok sama emina,bagus,dri dulu emina,emina,emina",bintang 5,8 bulan lalu
"imut & praktis dibawa kemana-mana dg kemasan baru seperti ini. warnanya ternyata lebih nude dari dugaan, saya kira agal peach ternyata bener2 nude & keliatan gak...",bintang 5,7 bulan lalu
"suka sm produk emina.. ringan.. cuma bb creamnya agak sedikit berminyak dimuka aku.. penjual ramah, pengiriman cepat jd cepat sampai.. pokoknya keren",bintang 5,
gak bikinn bibir kering sama sekali👍🏻👍🏻 terus warnanya juga bagus buat base ombree,bintang 5,7 bulan lalu
cepet bgt dr mulai order hingga barang sampe. dapet bonus face wash dan capsule mask pula. makasih emina,bintang 5,
"warna peach a boo, awal apply oily lama2 jadi mate",bintang 5,2 bulan lalu
"Alhamdulillaah, istri saya suka bgt bgt sm produknya 😄 Adminnya bnr2 ramah dan helpful, pokoknya good listener dan answer, harga sesuai sm kualitasnya yg bagus, pengirim...",bintang 5,
"Kirain gak cocok sama warnanya, ternyata bagus jugaaa",bintang 5,1 minggu lalu
creamatte emina gausah diraguin deh ga bikin kering dan ringan bgt,bintang 5,11 bulan lalu
"beli 2 pas 7.7 kemarin lumayan banget dari harga 80k jadi 35k doang.
beli baby fox sama mauvelous, kalau dari warna cantik semua gak zonk di aku. cuma agak sayang aja bua...",bintang 4,10 bulan lalu
warna nya cakep bentuk nya juga gemesin sukaa🤗packing rapi aman banget👍 padahal cuma beli 1 produk aja😭 makasih,bintang 5,
ini lipstik udah repurchase entah berapa kali. selalu suka warnanya. walaupun udah nyoba merk lain tapi selalu balik lagi ke doi. makasih ya udah ngasih bonus lip cushion,bintang 5,
"MANTUL BGTT!! bahannya ringan bgt, ga bikin bibir keringg dan super stainn, luvv emina!! 🥰",bintang 5,9 bulan lalu
"bahannya ringan di bibir, coco di bibirku gak buat kering..",bintang 5,10 bulan lalu
"Dapet harga murah bangett
Baru mulai coba, semoga sesuai sama claimnya",bintang 5,8 bulan lalu
"teksturnya ringann bgt ga bikin berat. warnanya cantikk, dan cocok wajah aku
bakal re purchase!",bintang 5,11 bulan lalu
"cari yg agak orange gitu,, belum coba tapi semiga warnanya masuk",bintang 5,12 bulan lalu
"cantik banget warnanya, packing aman, pengiriman cepat",bintang 5,3 minggu lalu
"pesen lipcream 2 tp dapet face wash nya jg 1, ini bonus ya? apa lupa ngasih? soalnya aku ngga pesen face wash.. trimakasih banyak ya, sesuai pesanan warna nya",bintang 5,
"warnanya gemes gemes banget, bener bener cocokk bikin muka cerah",bintang 5,6 bulan lalu
yeee dapet bonus lip matte senengnya makasih emina,bintang 5,
"emina masih paling okee bgt dari harga, warna, formulasi, thank youu dapet gift juga 😍😭",bintang 5,
so happy ternyata shadenya cocok bgt di bibir aku yg kulitnya kuning langsat,bintang 5,
"bagus banget buat base ombre, mana murce bgt lagi disc+dapet potongan lagi. beli 2pcs cuma 20k OMGG LUVVVV! 🫶🏻✨️
next mau beli shade lain~",bintang 5,
"beli kedua kali, kali ini dapet harga 15rb aja. bagusss banget sukak",bintang 5,3 bulan lalu
baru tau klo emina lipcream ganti kemasan.. udh kedua kalinya ini beli emina lipcream dan cocok bgt,bintang 5,6 bulan lalu
"Bagus warnanya, coklat pas di bibir saya, sekali swipe cover bibir",bintang 5,7 bulan lalu
"kalau untuk saya terlalu merah ternyata, cocok-cocokan ternyata (11 Amazeballs)",bintang 5,
Dr awal cocok pake creamatte ini wrna nya bgus.,bintang 5,
"tekstur lembut, matte tahan lama tapi ga cocok di kulit aku yg sawo matang huhu",bintang 5,
"warnanya cakep sukak,,, imut enak buat dibawa bawa. packing aman cuma kemaren pengiriman pake nyasar ke tegal😄😄😄 jd agak lama datengnya",bintang 5,
"lipmate incaran udh lama , dan dpt harga promo pula.... thanks tokopedia,  seller dan kurir
warna nya lun cantik dan tidak terlalu menor di bibir",bintang 5,5 bulan lalu
"lip creamnya ringan, mudah diratakan dan rahan lama, dicuci pakai sabun tidak langsung hilang",bintang 5,
Warnanya cantik & pengaplikasiannya cukup mudah. Gak nyangka dapat bonus squeeze me up up matte jg. Terima kasih 💕,bintang 5,
pengiriman cepat dan produk sesuai pesanan. semoga nanti cocok dan beli lagi,bintang 5,
"fast respon, pengiriman cepat, produk okeeee👍🏻👍🏻👍🏻",bintang 5,
terimakasih sudah diterima dengan baik. packing rapi dengan buble wrap agar kemasan tidak pecah. Desainnya lucu.,bintang 5,
"kirain warna nya bakal nude ala² gitu, tpi ternyata agak kemerahan yaa, tpi blm dicoba oles ke bibir juga sih",bintang 5,
enak bgt powdery gt kerasa bgt sih tp oklah shadenya ok bgt aku suka,bintang 5,9 bulan lalu
lucu banget dapet hadiah yang versi mini nya 😍😍,bintang 5,10 bulan lalu
"barang sampai dg baik. warnanya jg cantik, moga cocok di aku yg sawo matang",bintang 5,
"Paket sdh sampe dgn aman. Selalu suka dgn creamatte Emina, warnanya cantik2. Yg Peach A Boo pucat di saya (krn kulit saya putih), yg Pomelova lebih fresh segar. Pkknya ba...",bintang 5,
"cepet sampenya kirain bakalan lama, ringam dibibir",bintang 5,5 bulan lalu
"sangat bagus kemasannya, saya sangat senang karena baru kali ini memuaskan",bintang 5,2 bulan lalu
"barang sudah sampai,packing aman banget n rapi...belum dicoba tp warna nya saya suka 😊 thanks seller 😇",bintang 5,
"Okok....Barang ok, pengiriman ok, seller ok...terimakasih...💗",bintang 5,
"Barang sesuai. Dapat diskon banyak.🙏
Pengiriman oke.",bintang 5,7 bulan lalu
"warnanya fresh, teksturnya ringan, transferproof. tks seller.",bintang 5,
"secantik ituuu warnanyaaa ❤️ ga bikin kering juga, suka bgttt",bintang 5,11 bulan lalu
"Suka bgt sama semuanya, perfect product with a perfect price ❤️❤️❤️❤️❤️👌",bintang 5,9 bulan lalu
"suka banget sama warnanya, untung gak salah pilih shade trus ringan juga di bibir😆",bintang 5,8 bulan lalu
belum dicobaa soalnya buat gitf tapi yakin produk emina bagus bagus,bintang 5,7 bulan lalu
"produknya bagus
dapat bonus juga. 
makasih emina",bintang 5,
Suka bangettt sama warnanya 💗💗 packing jga aman,bintang 5,3 hari lalu
"08 Pumpkin: Warna natural, tekstur lembut, ringan.",bintang 5,
"mksh pesenanku udh tiba tepat waktu,produknya sesuai pilihanku,lipstik favorit dr Emina the best",bintang 5,
Cocok untuk anak Pelajar seperti aku terimakasih emina. Next bakal beli shade yg lainnya 🫰🏻,bintang 5,8 bulan lalu
bagus banget.. selalu suka dengan produk emina,bintang 5,2 bulan lalu
"barang sampe dengan selamat, sesuai aplikasi juga, terima kasih",bintang 5,7 bulan lalu
"thanks banget lho,, bonusannya. beli lipcream satu dapat bonus 2 sukakkk",bintang 5,
"warna nya cantik banget, nude tapi tetep pink fresh gitu sukakkk! 🩷",bintang 5,9 bulan lalu
warna nya cantik cocok dikulit sawo mateng teksturnya matte dan minin transfer,bintang 5,6 bulan lalu
bagussss banget!!! packingnya cepet dan aman banget padahal cuma beli satuuu. thank you sm! 🫶🏻🫶🏻🫶🏻,bintang 5,8 bulan lalu
"paketan dibungkus rapih dan ok, trimksh hadiahnya 🙏🙏",bintang 5,
"Baguussss
selalu sukak sm creamate emina
Shade sunset blaze fav aku
teksturnya ringan, enakeun pokoknya mah",bintang 5,
Hasilnya matte. Nggak cepat pudar.,bintang 5,
Teammatte no. 3 warnanya makin ciamik kalo dipadu sama vaseline lip therapy yang pink ❤️,bintang 5,
best banget lipmatte emina yg beet bites 👌🏼,bintang 5,
"akhirnya paket yang ditunggu2 dateng! terima kasih emina, beli lip cream dapet eyeliner pencil, so love it 😍",bintang 5,
"alhamdulillah dpt free trs, sudah langganan dsni😊",bintang 5,
"barang sesuai, Terima kasih selalu konsisten ngasih bonus.",bintang 5,
makasih emina udah ngasih bonus dan kusuka warnanya. sukses terus yaaa,bintang 5,
mkaasih bonus nya.. barang smp dgn selamat.. utuh,bintang 5,
trima kasih... barang sesuai pesanan. dapet bonus topi lg,bintang 5,
"produk sudah sampai, will do repurchase later
thank you seller :)",bintang 5,
"bagusss.... lembab di bibir, G kering, makasih",bintang 5,1 bulan lalu
"melembabkan banget bagusss
terbaik produk emina",bintang 5,10 bulan lalu
"barang ok, packing aman, recoment bgt..",bintang 5,
"cakep bgt warnanya, nude to coral",bintang 5,2 bulan lalu
"Alhamdulillah paketnyaa sudahh datang. ringan banget dipakainyaa, warnanyaaa favorite dehh! 🥰",bintang 5,11 bulan lalu
BAGUS BANGET BUAT BASE OMBREE!!!,bintang 5,
"tahan lama awet banget warna bagus, sip dahhhh",bintang 5,9 bulan lalu
xixixi trims yh emina sudah kasih ak free gift love you🥰🥰😘😘,bintang 5,9 bulan lalu
"enak banget teksture nya.. cocok buat bibir kering . pokok jangan lupa lip balm dulu
untuk warna 07 di kulit gelap emang aneh kalau di pakai keg lipcream biasa . tapi bag...",bintang 5,
Aplikator mudah dipakai. Desainnya lucu. Nggak cepat pudar. Nggak lengket. Nggak bikin bibir kering. Cocok buat kulit gelap.,bintang 5,
"warna nya bgus, nyaman dpakainya...",bintang 5,7 bulan lalu
Ini aweet bgt lohh dipake seharian masih nempel padahal pake masker dan buat makan jugaa .. cuma rada ga suka sama aplikatornya kurang nyaman aja,bintang 5,10 bulan lalu
warnanya mayan bagus dan bs full coverage bibir. aplikator bentuknya ky tapak sepatu jd agak menyulitkan untuk aplikasi yg rapi buat yg ga biasa. perlu touch up setelah m...,bintang 4,4 bulan lalu
Sesuai dengan pesanan. Terima kasih seller 🙏🏻.,bintang 5,
"pengiriman bagus, respon cepat, produk high quality",bintang 5,
"warnanya bagus, soft & gorgeous. repurchase tapi waktu itu beli offline. yang ini dateng” kayak ada minyak gitu lip produk sama minyaknya gabisa nyatu kecewa bgt tapi...",bintang 4,
"Buat orang yang bibirnya kering banget, pakai lip balm dulu tipis aja udah cukup tahan lama ini lip matte, padahal udah kemusuhan sama berbagai lip matte saking kering da...",bintang 5,1 bulan lalu
"Warnanya nutup banget ya utk bibir gelap. Aplikasiinnya mudah rata, trus pas ngeset dia gak lengket nyaman banget walau masih transfer sedikiiit. Si Starfish ini warnanya...",bintang 5,
"sangat memuaskan, adminnya gercep",bintang 5,
"Barang ok, seller juga respon cepat. Ekspedisinya aja yg bikin lama, Sicepat yg tidak sesuai namanya. Udah di pick up dr jumat jam 11 siang sm kurirnya, padahal deket, eh...",bintang 5,
"Barang original, produk baik harga baik dapet promo next order disini lagii",bintang 5,
"cakepp bgt warnanya, ringan banget dipake di bibir dan ga lengket",bintang 5,5 bulan lalu
selalu pke lip cream ini krn texturenya ringan bgt. kyk gak pke apa2 rasanya. warna juga cocok bgt. dan respon seller dr sejak proses sampe pengiriman selalu cepat. paket...,bintang 5,
"Packingan nya bagus, dapet ekspedisi nya dapet yang ramah dan sabar banget. Plus aku dapet bonus dari emina, terima kasih banyak min. Sukses selalu 🤲",bintang 5,
Sumpah warna dan teksturnya bagus banget,bintang 5,
warnanya bagus. agak kering di bibir tp msh bs diakali dgn pakai lip balm dulu sebelumnya,bintang 5,
Lipcreamnya bener” awet poll buat mam cuanki yg berminyak tetep nempel,bintang 5,10 bulan lalu
"udah 5thn lebih pake creamatte ini yg versi lama, tau2 gabri botol jadi baruuu. Jujur enakan yg packaging lama, lebih enak aplikasiinnya. Tapi tetep suka bgt sih krn warn...",bintang 5,8 bulan lalu
Desainnya mewah. Nggak lengket. Packaging rapi.,bintang 5,
"barangnya sampai dengan selamat, dapat gratisan masker pula, tengkyu emina😍",bintang 5,
"pengiriman cepat,packaging nya aman bgt udah pake bubble wrap yg super duper tebel udah gt pake kardus lg",bintang 5,
"pakingnya sangat aman , dan barang original",bintang 5,
Hasilnya tahan lama. Cocok buat kulit gelap. Aplikator mudah dipakai. Hasilnya matte.,bintang 5,
"seller responsif, barangnya sesuai dengan pesanan, saya suka warna lipstik matte nya ini ""Perky Plum"" cocok sekali utk sy.",bintang 5,
"cocok untuk kulit sawo matang, bikin wajah cerah",bintang 5,
Makasih seller barangnya sesuai pesanan saya suka lipstiknya ringan di bibir dan nyaman utk digunakan sehari-hari.,bintang 5,Makasih seller barangnya sesuai pesanan saya suka lipstiknya ringan di bibir dan nyaman utk digunakan sehari-hari.
"Ringan, warna bagus, kalo udh kering jd rada transferproof. Oke banget dan harganya terjangkauuuuu!",bintang 5,8 bulan lalu
"beli krn lg diskon...sbnrnya lbh sukak sm model yg lama, yg baru ini kyk sekali sweb lgsg luber2 belepotan, sm cara ngebubleinnya mgkin hrs diperhatikan, ini segitu diamb...",bintang 4,12 bulan lalu
